neutral,"Presentation materials will be posted on the company 's website : www.seahawkdrilling.com in the `` Investor Relations '' section , on the `` Webcast & Presentations '' tab ."
neutral,"Previously , Grimaldi held a 46.43 pct stake in the Finnish company following the takeover bid launched in November 2006 ."
neutral,"Price talk is in the mid-market swaps plus 105 bps area and the leads are Barclays , BNPP , UBS and CBA ."
neutral,"Prior to the transaction , whose financial terms have not been disclosed , Alma Media owned 40 % of Kotikokki net ."
neutral,"production facilities 6 July 2010 - Finnish investment group Neomarkka Oyj ( HEL : NEMBV ) said today that it will buy the former production facilities of Kuitu Finland Ltd , as part of negotiations on the option to invest in specialty cellulose fiber business ."
neutral,"Products include Consumer Electronics devices such as mobile phones and their accessories , set-top boxes , flat panel TVs as well as System Solutions products such as infrastructure systems , modules and other industrial segment products ."
neutral,"Proha Plc ( Euronext :7327 ) announced today ( 19 May ) that its fully-owned subsidiary , Safran Software Solutions AS , has agreed to sell its 49 % share of Safran North America LLC to a SNA Holding AS , an investment group based in Norway ."
neutral,"Proha Plc ( Euronext :7327 ) announced today ( 19 May ) that its fully-owned subsidiary , Safran Software Solutions AS , has agreed to sell its 49 % share of Safran North America LLC to a SNA Holding AS , an investment group based in Norway ."
neutral,"Proline Plus is available in both adjustable single and multichannel models and fixed volume single-channel models , in volume ranges from 0.1 micro litres to 10 ml ."
neutral,"Protalix closed at $ 10.71 on Friday on the American Stock Exchange , giving a market cap of $ 827 million ."
neutral,Protalix is developing genetically engineered proteins from plant cells .
neutral,"Purchase it for the 12MP snapper , if nothing else ."
neutral,R&D Loan ) .
neutral,Radiation and today is a full service house expert in radiation and nuclear safety issues .
neutral,Raisio is the site of the main production plants as well as company headquarters .
neutral,Rapala VMC Corporation ( Rapala ) is a Finland-based company engaged in the manufacture and distribution of fishing equipment and accessories .
neutral,"Rautalinko was resposnible also for Mobility Services , and his job in this division will be continued by Marek Hintze ."
neutral,Recently the company decided to build a second identical plant at the same site due to be commissioned toward the end of 2008 .
neutral,"Retail chain Suomen L+Æhikauppa was given the index 5.8 , airline SAS 5.8 , TeliaSonera 's broadband 6.1 , German retail chain Lidl 6.1 , Tele Finland 's mobile subscriptions 6.1 , Tallink shipping line 6.3 , and power company Helsinki Energy 6.3 ."
neutral,"Risto Jalo , chief executive of Dormus Print and also owner of the remainder of the company , will keep his position after the acquisition ."
neutral,RL-Nordic is a part of Raiffeisen-Banking-Group Austria and is a subsidiary to Raiffeisen-Leasing GmbH in Austria .
neutral,"Rockwell Collins is a provider of flight deck , cabin and information management solutions for business aircraft operators ."
neutral,"s business sectors are building construction , infrastructure construction and technical building services ."
neutral,Salcomp Manufacturing Oy will pay EUR 35 million in cash to Salcomp in connection with the implementation of the sale and transfer of the Business .
neutral,"Sampo Housing Loan Bank , a unit of Finland 's Sampo Bank , has priced its EUR1bn ( USD1 .3 bn ) bond at 99.889 % , Reuters reported ."
neutral,SAMPO PLC Jarmo Salonen Head of Investor Relations and Group Communications tel. +358 10 516 0030 Distribution : NASDAQ OMX Helsinki The principal media Financial Supervisory Authority www.sampo.com This announcement is distributed by Thomson Reuters on behalf of Thomson Reuters clients .
neutral,"SAN FRANCISCO ( MarketWatch ) -- Nokia Corp , the world 's largest cell-phone maker , is using the Consumer Electronics Show in Las Vegas to introduce a high-end , thin folding phone , according to a media report Monday ."
neutral,Sanoma Magazines International will invite other shareholders holding approximately 15 % of the shares to sell their shares .
neutral,Scanfil plc is a global contract manufacturer and systems supplier for communication and industrial electronics .
neutral,"schwalm ( at ) outotec.com Eila Paatela , Vice President - Corporate Communications tel. +358 20 529 2004 , mobile +358 400 817198 e-mail eila ."
neutral,"SDM offers general rental equipment , aluminium scaffolding , power generator and hoists to customers in the construction sector ."
positive,services supplier Efore Plc to streamline operations in Finland and the US Finnish electronic systems and services supplier Efore Plc ( OMX Helsinki : EFO1V ) said on Tuesday ( 3 February ) that it has initiated statutory negotiations regarding a streamlining of its operations in Finland .
neutral,"Seventy-three of those also have more extensive training in products built on the latest ArchestrA technologies , such as the Wonderware System Platform ."
neutral,"Simultaneously , Alma Media has purchased a 35 % share of Arena Interactive , a subsidiary of Arena Partners with a focus on mobile solutions development ."
neutral,"Simultaneously with this merger plan another merger plan has been signed , according to which Suomen Projektivuokraus Oy , a subsidiary of VTM-Rakennuskonevuokraamo Oy , would be merged with VTM-Rakennuskonevuokraamo Oy ."
positive,Singapore in May 2011 1 July 2010 - Finnish air carrier Finnair Oyj ( HEL : FIA1S ) said today it will open a daily route to Singapore on 30 May 2011 as part of its growth strategy in Asia .
neutral,"So far as is known , he did not sell shares that he owns personally ."
neutral,Solidium now holds 5.0 per cent of the shares Solidium Oy has acquired 5.0 per cent of the shares in Tieto Corporation for approximately EUR 58 million .
neutral,"Some 3.8 mln euro ( $ 5.2 mln ) of the base acquisition price will be paid in cash and the rest through a subscription offering of a total of 850,000 new Ixonos shares ."
neutral,Some of the lay-offs will be implemented using part-time employment contracts .
neutral,"Sonoco Products Co. , a U.S. packaging company , said Friday it bought the 75 percent of Italy 's Demolli Industria Cartaria SpA it did not already own ."
neutral,"Sponda is a property investment company , specialising in commercial properties in the largest cities in Finland and Russia ."
positive,"ST. PETERSBURG , Oct 14 ( PRIME-TASS ) -- Finnish tire producer Nokian Tyres plans to invest about 50 million euros in the expansion of its tire plant in the city of Vsevolozhsk in Russia 's Leningrad Region in 2011 , the company 's President Kim Gran told reporters Thursday ."
neutral,Stichting Pensioenfonds ABP : 4 118 122 shares representing 5.19 % of the share capital and voting rights .
neutral,"Stockholm , 3 March 2011 About Cybercom The Cybercom Group is a high-tech consultancy that offers global sourcing for end-to-end solutions ."
positive,"Stockmann and Swedish sector company AB Lindex entered into an agreement on September 30 , 2007 , whereby Stockmann , or a wholly-owned subsidiary of it , will make a public tender offer for all of Lindex 's issued shares ."
neutral,"Stora Enso has also had meetings with the labor authorities , Employment and Economic Development Centres and representatives of the government in order to find solutions ."
negative,"Stora Enso Oyj , the largest papermaker , in October said it would close four mills ."
neutral,"Subscribers of China Unicom , the nation 's second largest mobile phone operator after China Mobile , are expected to release pictures , videos and blog on the Internet via mobile phones as of March 2008 ."
neutral,Sunrise Resources operates in Russian near-shore development markets through its wholly-owned Russian subsidiary and has 80 % of its personnel in Russia .
neutral,"Swiss bank Credit Suisse International will act as an investor in the locomotive manufacturing plant , the Astana administration said ."
neutral,"Talvivaara Mining Company PLC ( Talvivaara Mining ) ( LSE : TALV ) , a Finland-based nickel mining business , has installed its second production line at its metals recovery plant on June 9 , 2010 ."
neutral,Talvivaara Mining Company Plc Talvivaara Mining Company is an internationally significant base metals producer with its primary focus on nickel and zinc using a technology known as bioheapleaching to extract metals out of ore .
neutral,"Tampere Science Parks is a Finnish company that owns , leases and builds office properties and it specialises in facilities for technology-oriented businesses ."
neutral,"Target company : Tieto Corporation , Business Identity Code : 0101138-5 Date of change in holding : 22 January 2010 Portion of the shares and votes : The current group holding of OP-Pohjola Group Central Cooperative ( OPK ) is 2982 587 shares , which represents 4.14 % of the shares and voting rights ."
neutral,Technopolis has approximately 130 customer companies in Jyvaskyla .
neutral,"Tecnomen , headquartered in Espoo , Finland , develops messaging and charging solutions for telecomms operators and service providers worldwide ."
neutral,"Tecnomen 's solution can be used for prepaid and post-paid billing , for charging and rating of voice and video calls , data traffic and any kind of content services in both mobile and fixed networks ."
neutral,"Tecnomen 's system features a new range of value-added services for prepaid and post-paid billing , charging and rating of voice calls , data traffic , or any kind of content services in both mobile and fixed networks ."
neutral,"TeliaSonera s subsidiary , the mobile operator EMT in Estonia , has created a world s first mobile identification service which makes it possible to vote via a mobile phone ."
positive,TeliaSonera said about $ 100 million will be invested in the next year in the region to bring mobile coverage to about 90 % of Nepal s population .
negative,"Temporary lay-offs , affecting the entire workforce , will also be implemented ."
neutral,"Teollisuuden Voima Oyj , the Finnish utility known as TVO , said it shortlisted Mitsubishi Heavy s EU-APWR model along with reactors from Areva , Toshiba Corp. , GE Hitachi Nuclear Energy and Korea Hydro & Nuclear Power Co. ."
neutral,Terms of the acquisition were not disclosed .
neutral,Terms were not disclosed .
neutral,"Thanks to the development of a system that enables it to trace the origin of all the palm oil that it uses , it knows exactly where and how its palm oil has been produced ."
neutral,"The 19,200-square metre technology center is located near University of Tampere in central Tampere ."
neutral,"The 5,000 megawatt wind farm being planned in Raahe would be built offshore in front of Ruukki 's Raahe Works ."
neutral,"The acquired plant has an annual capacity of some 300,000 tonnes and most of its production is sold to domestic customers ."
neutral,The acquisition is expected to take place by the end of August 2007 .
neutral,The acquisition of AVC Systemhaus and the majority stake in Cableway will increase the number of Teleste personnel by 250 .
neutral,"The acquisition was financed with $ 2.56 billion of debt arranged by Goldman , Sachs & Co. ."
neutral,"The airline was targeting travel agents , tour operators and travel management companies to raise awareness first before targeting consumers , he added ."
neutral,"The Annual Report contains the financial statements , the consolidated financial statements , the report by the Board of Directors and the auditor 's report ."
neutral,"The Annual Report will be sent automatically to shareholders holding at least 2,000 Sampo plc shares ."
neutral,"The Apple Inc. iPhone wo n't change the game plan for Verizon Communications Inc. , Chief Executive Ivan Seidenberg said Wednesday ."
neutral,"The approximately 20,000 dwt vessel has been ordered from India ."
neutral,The arrangements do not apply to the group 's units outside Finland .
neutral,"The Bank of +_land acquired the private banking business , asset management , and share brokerage business of Kaupthing Sweden in early 2009 ."
neutral,"The Bank of Tokyo-Mitsubishi UFJ , Ltd acted as agent for the loan ."
neutral,The bank VTB24 provides mortgage loans to buy apartments in the complex at 11-13 % per annum in rubles .
neutral,"The biggest sellers in the chain 's supermarkets in Finland are organic Pirkka tomatoes , carrots , eggs , and meat products ."
neutral,The bond has a value of EUR150m and a maturity of 4 years .
neutral,The bridge will be built to the south of the existing bridge spanning the strait .
neutral,"The building will house , for example , Respecta Oy 's Jyvaskyla premises , as well as other companies to be announced later , says Samuel Koivisto , Director of Technopolis operations in Jyvaskyla ."
neutral,"The business goals for 2009 will realize with the temporary lay-offs carried out in the summer of 2009 , and with other savings measures ."
neutral,"The business units of the InvestLesProm Group cover the full forest industry chain , and the Group owns forests , sawmills , paper and pulp mills , and other processing plants ."
neutral,"The businesses to be divested offer dairy , edible fats , ready-meal and ice-cream packaging to multinational and local customers ."
neutral,"The casing comprises a first side casing member provided with the first side vat segment and a second side casing member provided with the second side vat segment , at least the first side casing member being pivotable about a rotation axis ."
neutral,"The changes will take effect on 1 January 2010 , and they are not estimated to have an impact on the number of employees ."
neutral,"The city will invite , however , a public procurement tender for the tailor-made public furniture , such as park benches , litter receptacles , public toilets , as well as bus shelters , street lights , and other ."
neutral,The combined value of the orders is almost EUR 3mn .
neutral,The combined value of the orders is EUR 45mn .
neutral,The combined value of the planned investments is about EUR 30mn .
neutral,The companies aim to close the deal before the end of the year .
neutral,The company also said that it will sell approximately 150 hectares of land to the city of Valkeakoski by the end of the year a part of its `` From job to job '' program .
neutral,"The company can not give up palm oil altogether , however ."
neutral,The company did not disclose the price of the acquisition .
neutral,The company distributes Hiab 's products as well as other products .
neutral,The company does not at present hold any of its own shares .
neutral,The company does not disclose the sum it applied for .
neutral,The company expects meat purchases to remain at about 8mn kilos in 2011 .
neutral,The company expects to open its first online shop in the US in the summer in 2011 .
neutral,"The company has decided to stop the operations of Ruukki Construction Division in Latvia and Lithuania , and concentrate the production and logistics in Parnu , Estonia in 2009 ."
neutral,"The company intends to launch housing development at the acquired land plots and to construct 50,000-60 ,000 square metres of housing per annum by 2011 ."
neutral,"The company is headquartered in Sievi , Finland , and is listed on the Nordic Exchange in Helsinki ."
neutral,The company may at any time have in its possession one tenth of all its shares at the maximum .
neutral,The company operates power plants in the Tyumen and Chelyabinsk regions and in the Khanty-Mansi Autonomous District .
neutral,"The company operates worldwide and employs in total approximately 47,000 persons ."
neutral,The company reiterates its outlook for 2009 .
neutral,"The company 's board of directors will propose a dividend of EUR 0.95 per share for 2008 at the annual general meeting , scheduled to be held on March 23 , 2009 ."
neutral,The company 's board of directors would propose a dividend of EUR0 .15 per share for 2005 .
neutral,The company 's board of directors would propose a dividend of EUR1 .00 per share for 2005 .
neutral,The company 's equipment rental portfolio consists primarily of tools for small and mid-sized customers in the construction industry .
neutral,The company 's model is based on developer contracting construction projects and customer focused project management .
neutral,The company said that the results of the third quarter do not include non-recurring items .
neutral,The company says the measures are no longer needed .
neutral,"The Company serves approximately 3,000 customers in over 100 countries ."
neutral,"The company serves customers in various industries , including process and resources , industrial machinery , architecture , building , construction , electrical , transportation , electronics , chemical , petrochemical , energy , and information technology , as well as catering and households ."
neutral,"The company serves customers in various industries , including process and resources , industrial machinery , architecture , building , construction , electrical , transportation , electronics , chemical , petrochemical , energy , and information technology , as well as catering and households ."
neutral,"The company was supposed to deliver machinery to a veneer mill in the Tomsk region , in Russia ."
neutral,"The company will also shut one paper machine in Finland and one in Austria , as well as two label paper machines in Finland for up to 10 months , Helsinki-based UPM said yesterday ."
neutral,"The company will disclose further details , including the anticipated transaction timetable and the name of the new investor , within one week ."
neutral,The company will issue an inaugural Eurobond deal in the near future subject to market conditions .
neutral,The company will propose a dividend of EUR0 .12 per share for 2008 .
neutral,The compnay also said that it would lower the price of development projects by about one third compared with last November .
neutral,The construction project is scheduled to start in the second quarter of 2009 and the new building is scheduled to be in place by the end of 2010 .
neutral,"The contract also includes installation work in a new multistorey carpark for close on 1,000 vehicles ."
neutral,"The contract comprises a log handling line , a peeling line , and a veneer drying and grading line ."
neutral,"The contract covers the supply of temporary heating equipment for LKAB 's new pellet plant in Kiruna , in northern Sweden ."
neutral,The contract has been allotted as per lowest price criteria .
neutral,"The contract includes design , construction , delivery of equipment , installation and commissioning ."
neutral,"The contract includes software licences , application maintenance and training ."
neutral,"The contract incorporates a Convergent Charging rating solution for voice and data , which includes Internet , GPRS , SMS , MMS and WAP ."
neutral,The contract is for next year .
neutral,The contract will take effect in 2009 for a five or ten year period .
neutral,"The contracts between Raute Corporation and Muling Kemian Wood Products Co. , Ltd. , which were announced on 3 November 2010 , have taken effect ."
negative,"The contracts of the employees , 96 of whom are blue-collar workers , will be ended between March and August 2011 ."
negative,The current lay-offs are additional to the temporary lay-offs agreed in December 2008 and in May 2009 .
neutral,The CVs of the proposed members are available for viewing from 12 March 2008 onwards on the Internet at www.sampo.com/ir .
neutral,The deal also includes a ten-year maintenance agreement .
neutral,The deal includes an option for Cramo to buy out the minority stake in 2011 .
neutral,"The deal includes the entire personnel of PlanMill Oy , who will transfer to the new company as so-called old employees ."
negative,"The decision means temporary lay-offs of fixed duration at the company 's Nastola and Jyvaskyla units , in southern and central Finland , respectively ."
neutral,"The decision of the French Court relates to the claims raised by twenty-one former Aspocomp S.A.S employees , the company said ."
neutral,The divested stake represented about 2.7 m shares in Okmetic 's capital .
neutral,The dividends payable annually shall be deducted from the share subscription price .
neutral,The duration of the contract is 37 months .
neutral,The duration of the lay-offs per employee will vary from one to six weeks .
neutral,The ECB can mainly target inflation .
neutral,The Efore plant at Saarijarvi in central Finland is one of the largest employers in the region .
neutral,The employee negotiations are to address measures needed to adjust the operations to the present production situation .
neutral,The energy shot is packed in a 100-millilitre bag with a screw cap .
neutral,"The engine has an electrical output of 18,321 kW , making it the largest gas powered generating set in the world ."
neutral,The Estonian parliament was set to vote on amendments to the excise duty law on Wednesday that would add 0.42 kroons to the price of a liter of diesel and 0.45 kroons to the price of a liter of gasoline from the start of 2010 .
positive,The executive group will participate in the adjustments with a fixed-term 5 % salary cut .
neutral,The exercise price of the option will be based on Safran Software Solutions ' license and maintenance sales as well as the result of the company .
neutral,"The facility will be used to refinance Citycon 's existing credit facility , the company said ."
neutral,The fair value of CapMan Plc 's own investments on 30 September 2008 amounted to MEUR 59.8 .
neutral,The financial details of the acquisition were not disclosed .
neutral,The financial details of the transaction were not disclosed .
neutral,The Financial Statements and Interim Reports will be released around at 9.00 a.m. ( Finnish time ) on the given dates .
neutral,The financial statements release will be available after publishing on the Company 's internet pages at www.cargotec.com .
neutral,The Finnish company has also reached arrangements regarding the working hours and annual holidays .
neutral,The Finnish paints company acquired the remaining 49 pct that it did not own from Ukraine 's LGU for an undisclosed sum .
neutral,"The Finnish real estate investment company Interavanti Oyj said on Monday ( 22 September ) that it has agreed to sell its 65 % ownership in the Finnish ticket service company Lippupiste Oy to CTS Eventim AG ( 56,1 % ) and to the managing director of Lippupiste Oy ."
neutral,"The firm is headquartered in Vantaa , southern Finland and has 16 employees ."
neutral,"The firm 's services include copying , printing , CAD-modelling , digital printing , scanning , SokoPro project bank and courier services ."
neutral,"The first four of the new shop-in-shops will be opened this spring : on Madison Avenue in New York as well as in Chicago , Los Angeles and San Francisco ."
neutral,The fixed acquisition price amounts to NOK 70 ( approximately EUR 8.7 ) million and additional price NOK 15 ( EUR 1.8 ) million at maximum .
neutral,"The fixed-term contract of Mr. Jarmo Ukonaho , the current General Manager of Incap 's Indian operations , will finish by the end of the year ."
neutral,"The flagship will open this fall in Manhattan 's Flatiron District in the `` Toy Building , '' at 200 Fifth Avenue ."
neutral,The full MidnightTrader extended-hours trading analysis and news service is available in real-time through COMTEX .
neutral,The full-function PC weighs 1.25 kilograms and measures slightly more than two centimeters thin .
neutral,The government has instead proposed an exchange of the state 's stake in LMT to TeliaSonera 's stake in Lattelecom .
neutral,The group reiterated its forecast that handset manufacturers will sell around 915 mln units this year globally .
neutral,"The Group 's business sectors are Building Construction , Infrastructure Construction , Technical Building Services , and Building Products ."
neutral,The group said it intends to initiate within this year the process of buyout of minority shareholders of Ragutis with the aim of becoming the sole owner of the company .
neutral,The GyPSii mobile social networking application is available in China with both Chinese and English language support .
neutral,The handset maker did not disclose any financial details .
neutral,"The hosting mobile terminal guides information flow between itself , the participating terminals , and optionally , with network servers that may assist the hosting mobile terminal ."
neutral,"The huge bridge girders will be delivered to the site from our plant in Ylivieska , Finland ."
neutral,The idea of saving electricity in data transfer is still a new one .
neutral,The identity of the buyer is not yet known .
neutral,The Insolvency Act regulates the amount of debt that borrowers are permitted to write off .
neutral,The intent of the article was to focus attention on the fact that the development model that China had followed was very different than the model that India had followed .
neutral,The investment would be some EUR5m .
neutral,"The latest result included per-share charges of 5 cents for stock compensation , 1 cent for research and development and 1 cent for strategic investments ."
neutral,The lay-offs will start gradually and will last from one to six weeks .
neutral,The machinery now ordered will be placed in a new mill with an annual production capacity of 40 000 m3 of overlaid birch plywood .
