positive,"`` Neste Oil has responded to the challenge posed by the European Union 's target of biofuels accounting for 5.8 % of traffic fuel usage in the EU by 2010 by developing its NExBTL technology for producing diesel fuel from renewables , '' the federation said ."
neutral,"`` Soon after , the collisions started . ''"
neutral,"`` The biggest challenge was to make the piece look raw , '' Hansen said ."
neutral,`` The rest of this week 's tapings of Jimmy Kimmel Live have been canceled until he is back on his feet .
negative,"`` There 's the issue of thieves stealing them from building sites , '' said Mr Smith ."
neutral,"`` We have a license agreement with Nokia Corp. which in part expires on April 9 , 2007 ."
negative,30 November 2009 - Finnish office furniture maker Martela Oyj HEL : MARAS said today that it will make redundant three people and other nine will be laid off permanently from the company 's office staff and factory workers .
neutral,4 January 2011 - Finnish media company Alma Media Corporation HEL : ALN1V said today its online recruitment service Monster Oy will partner with local newspaper publisher Suomen Lehtiyhtyma in listing job advertisements .
neutral,A 2001 agreement expired earlier this month .
neutral,"A few months ago , Teva vice chairman Phillip Frost and Marathon Venture Capital Fund TASE : MARA sold Protalix shares ."
negative,"After Chuck Smith was laid off on May 30 from his $ 90,000 housing consultant job , he and his wife had to cut spending in half for their family of six , having to rely on his wife 's income -- about the same as his -- alone ."
neutral,"After the split , the company would have 26,885,540 Series A shares and 9,540,000 Series K shares ."
neutral,"After the transaction , Herttaassa 's holding in Alma Media has fallen below the flagging limit of 5 % ."
neutral,And Ogden reportedly will shell out $ 4.2 million .
neutral,"At 3:37 p.m. Eastern time , a block of 2,400 contracts changed hands at a bid price of $ 0.45 ."
negative,"Belarus OAO Lidskoe Pivo brewery , based in the Grodno Region , reported a 1.1 % decrease in output to 1.045 million decaliters in January-March 2010 , a representative in the administration of the company told ."
neutral,"Boomeranger Boats Oy specialises in boat building and designs , manufactures and sells customised Rigid Inflatable Boats RIB primarily for the Baltic Sea market ."
neutral,"Cramo 's manager Jarmo Laasanen said hiring of equipment and machinery in Lithuania differs from the other Baltic countries in that in Lithuania still many public structures such as roads , bridges , airports and shops are being built ."
neutral,Currently the quarterly applied surcharges differ significantly from the actual market prices .
neutral,Filmiteollisuus Fine Ab will be transferred to Talentum Oyj in the form of a subsidiary .
neutral,Finnish bank Alandsbanken said Monday it will buy the Swedish operations of Iceland 's troubled Kaupthing Bank for 414 million kronor $ 49.5 million in cash .
neutral,Fortum also has a blocking stake in Northwestern TGK-1 .
neutral,"He found him again , however , after the driver was involved in a two-car accident ."
neutral,"HELSINKI AFX - Salcomp , the mobile phone charger manufacturer , said it has appointed Markku Hangasjarvi as its new CEO , following the resignation of Mats Eriksson ."
neutral,"HK Ruokatalo produces many turkey products , such as cold cuts ."
neutral,"However , the brokers ' ratings on the stock differ ."
negative,"However , the suspect stole his burgundy Nissan Altima ."
negative,"In a media advisory , the NTSB said that after subsequent testing , `` the train detection system intermittently failed . ''"
negative,"In Finland , snow storms brought trees down on power lines , cutting off electricity for some 2,000 households ."
neutral,"In the spring 2006 , a total of 386,530 Stock Options 2002 B were annulled ."
neutral,"Information system supplier Sentera -- up 24.51 pct -- was the next most heavily traded share after SysOpen Digia , a software house , acquired 77.4 pct of the company this morning for just under 33 mln eur ."
neutral,It 's very difficult to become a Google Analytics channel partner .
neutral,"Juhani J+Ærvi , Corporate Executive Vice President of Kesko , says the Russian food retail sector is fragmented ."
negative,Layoffs will also take place at the Suomussalmi and Kuhmo plants this autumn as a result of codetermination negotiations held there .
negative,Metso estimates the need for personnel reductions to amount to 25 people .
negative,Most of the layoffs will be in Finland .
negative,"Most of the permanent layoffs will be in the plywood and sawn timber sectors of the Finnish company 's operations at several domestic mills , where earlier this year it temporarily laid off some 1,200 workers to save costs ."
neutral,"Motorola , the world 's second-largest maker of cell phones , unveiled the new phone Tuesday in a bid to resurrect its ailing handset business ."
neutral,Mursula said they tried to gather macro-economic perspective to see how Malaysia was doing .
neutral,Niklas Skogster has been employed by the ABB Group in various positions concerning the development of operations .
negative,"Paper companies were in negative territories , with Stora Enso R shedding 1.62 pct to 12.73 eur , UPM-Kymmene down 0.80 pct at 18.64 eur and M-real B 0.18 pct lower at 5.57 eur ."
neutral,Rautaruukki aims to find work from the group 's other locations for those who have been made redundant .
neutral,Temporary layoffs in these units have already started .
neutral,The beers differ slightly from mainstream beers .
neutral,"The company operates a U.S. division in Lisle , Ill. ."
neutral,The company says it is difficult to estimate the market situation for the whole year 2009 .
neutral,"The contract also includes cutting and edging wagon parts at Ruukki 's steel service centres in Seinajoki and Raahe , from where they will be delivered to VR for welding and assembly ."
negative,The current reference grade instruments are challenging to operate due to their high price and complexity for routine use .
neutral,"The deal covers Stockmann Auto Oy Ab 's sales and after-sales services concerning Volkswagen and Audi in Helsinki , Espoo and Vantaa ."
neutral,The difference can be explained by the fact that two shipping companies have stopped operating in the Gulf of Finland .
negative,"The dollar fell , though , against the pound and the yen ."
neutral,The dual-fuel engines of the vessel can operate on liquefied natural gas LNG with low emissions .
neutral,The emerging markets that Raisio has chosen to enter so far are marked by relatively low per capita food consumption .
neutral,"The employer , together with health personnel , supports quitting and pays part of the cost of nicotine treatments ."
neutral,"The equipment is designated to Bollore Africa Logistics terminal Societe d'Exploitation du Terminal de Vridi SETV in Abidjan , Ivory Coast and the delivery is scheduled to start in March 2010 ."
neutral,"The evidentiary hearing in the Investigation is scheduled for April 21 - May 1 , 2008 ."
neutral,"The Finnish food concern Atria is about to acquire two Estonian meat processing companies , Woro Kommerts and Vastse-Kuuste Lihatoostus , reported the Official website www.investinestonia.com ."
neutral,"The floor area of the Yliopistonrinne project will be 7,900 sq m and the building 's gross area will total 12,800 sq m. A total 25.1 % of the facilities have been let ."
neutral,"The floor area of the Yliopistonrinne project will be 7,900 sq m 85,030 sq ft and the building 's gross area will total 12,800 sq m. A total 25.1 % of the facilities have been let ."
neutral,The measures result from the statutory joint negotiations with employees which started in February and concerned all operations in the country .
neutral,"The NTSB said investigators are set to conduct sight distance tests on July 18 , using trains similar to those involved in the accident ."
negative,The number of salaried employees and group administration employees to be dismissed from the Sievi units is 17 .
neutral,"The pine oil project is related to the upgrade of the chemical recovery plant of UPM at its pulp mill in Kymi , southern Finland ."
neutral,"The product range includes marinated olives , cold cuts , and pates , for example ."
neutral,The statutory negotiations at headquarters are part of this decrease .
neutral,"The talks concerned about 160 people in Finland and the initial estimate was for about 35 redundancies , Fiskars said ."
neutral,The terms and conditions of the year 2003 stock option scheme were published in a stock exchange release on 31 March 2003 .
negative,The total number of filling stations has been on the decrease recently .
neutral,These restrictions do not apply to statutory dividends .
neutral,"This action follows personnel negotiations concerning Elcoteq SE , Finnish Branch , Elcoteq Finland Oy and Elcoteq Design Center Oy ."
neutral,"Unbelievably , the company that makes them - Fiskars Corporation - was formed in 1649 when a Dutch merchant named Peter Thorwoste was given a charter to establish a blast furnace and forging operation in the small Finnish village of Fiskars ."
negative,"We have also cut our price projections for paper and packaging , '' an analyst with Goldman Sachs said on a note on Monday ."
neutral,Why put up costly cell phone towers in thinly populated areas when a few balloons would do ?
neutral,"Viking Line has also been forced to alter its timetable so that ferries traveling from Stockholm to Helsinki , Finland , only depart at night ."
neutral,Yakima created the position for him after emerging from economic downturns of its own .
neutral,"zip , '' experts warned Tuesday ."
negative,Finnish industrial group Ruukki Group has brought counter action against Finnish metal company Rautaruukki in the dispute concerning the names of the companies .
neutral,"This one was at one time targeted for June 5 , but if we had to guess , it 's been pushed back -- maybe we 're crazy , but we feel like it has n't leaked enough to meet that date at this point ."
negative,Border Guard Service has banned the mooring of the company car-shipping ferry on its test travel at the railroad-car terminal of the Russian port as the border checkpoint is not yet ready .
negative,`` Those uncertainties cloud the long-term outlook . ''
negative,"20 October 2010 - Finnish environmental management company Lassila & Tikanoja Oyj HEL : LAT1V , or L&T , said Monday it expects its operating profit , excluding non-recurring items , for the whole 2010 to be slightly lower than in 2009 ."
negative,"According to Finnish petrol station chain St1 's managing director Kim Wiio , the company was forced to make purchases with rising prices in the first half of 2008 , and now consumer prices are going down almost daily due to competition ."
negative,"According to the Latvian business register , Uponor Latvia closed in red with LVL 99,000 EUR 139,538.17 USD 194,556.48 on turnover of LVL 2.346 mn for 2009 ."
negative,"Dolce & Gabbana has asked the European Union to declare Marimekko Corporation 's `` Unikko '' floral pattern trademark invalid , in a continuing dispute between the two companies ."
negative,Finnair said that the cancellation of flights would cause daily losses of  x20ac 2.5 million US$ 3 million .
negative,"Food sales totalled EUR 323.5 mn in October 2009 , representing a decrease of 5.5 % from October 2008 ."
negative,"ADP News - May 29 , 2009 - Bank of America BofA downgraded today its ratings on Swedish-Finnish paper maker Stora Enso Oyj HEL : STERV and on Finnish sector player UPM-Kymmene Oyj HEL : UPM1V to `` underperf"
negative,Operating profit excluding non-recurring items totaled EUR 5.4 mn compared to EUR 5.5 mn in the corresponding period in 2007 .
negative,"Raute reported a loss per share of EUR0 .86 for the first half of 2009 , against EPS of EUR0 .74 in the corresponding period of 2008 ."
negative,The air traffic of Finland has been in stoppage since then .
negative,The hack had been extra nefarious because the tweets activated without being clicked on - it was enough for Web surfers to move their mouse cursors over them .
negative,The move was triggered by weak demand for forestry equipment and the uncertain market situation .
negative,The situation of coated magazine printing paper will continue to be weak .
negative,A high court in Finland has fined seven local asphalt companies more than   lion ( $ 117 million ) for operating a cartel .
negative,"The Estonian electronic components factory , Elcoteq , is running out of material because of the closure of air traffic ."
negative,"All the ferries had run into trouble just outside the Stockholm archipelago , made up of more than 20,000 islands ."
negative,And U.S. energy executives say high steel prices are threatening energy exploration .
negative,"As capacity was cut with 1.4 % , the passenger load factor was down 7.8 percentage points ."
negative,"At present , the trade mark Pit-Produkt is little-known outside the North-West of Russia ."
negative,"Copper , lead and nickel also dropped ... HBOS ( HBOS ) plummeted 20 % to 70.3 pence after saying this year+ˆ ??"
negative,"Divisional sales demand in the half remained `` inconsistent '' , it added ."
negative,"During the strike , Finnair estimates to incur a net loss of between EUR2m and EUR2 .5 m per day ."
negative,Earnings per share ( EPS ) dropped to EUR 0.21 from EUR 0.31 .
negative,EMSA Deputy Chairman of the Board Juri Lember told BNS on Wednesday that this was the first time he heard about the strike as the Swedish side had not informed the Estonian union yet .
negative,"Finnair 's passenger load factor , which measures the number of sold seats as a share of all available seats , dropped by 1.3 percentage points to 76.7 % in September ."
negative,"Frost sold shares for $ 19 million at $ 6.06-7 .12 per share , compared with Friday 's high of $ 11.33 and low of $ 10.14 ."
negative,Full-year operating result for 2008 was 3.6 million negative .
negative,Glaston 's net profit for the third quarter of 2007 dropped to 2.4 mln euro ( $ 3.5 mln ) from 3.5 mln euro ( $ 5.1 mln ) for the corresponding period of 2006 .
negative,"In Q1 of 2009 , the company 's result before taxes from continuing operations , excluding non-recurring items , totalled EUR -0.4 mn , compared to EUR -0.1 mn in the corresponding period in 2008 ."
negative,Kone said in court papers that the union action delayed repairs to elevators at the federal courthouse on Jan. 21 and the Saltonstall state office building on Jan. 23 .
negative,L&T 's net profit for the whole 2010 dropped to EUR 36 million from EUR 45 million for 2009 .
negative,"Lassila & Tikanoja 's operating profit excluding non-recurring and imputed items for the second quarter was EUR11 .3 m , down from EUR13 .8 m a year ago ."
negative,Last year 's third quarter result had been burdened by costs stemming from restructuring in the US .
negative,"Many of the commercial vessels had got stuck in the narrow Bay of Bothnia , where the ice is thicker , and around the Aaland islands ."
negative,"Net cash flow from operating activities was a negative EUR 3.1 mn , compared to EUR 23.3 mn in the corresponding period in 2009 ."
negative,"Net cash from operating activities was a negative EUR 0.3 mn , compared to EUR 30.9 mn in 2009 ."
negative,Net sales dropped by 6 % year-on-year to EUR 11.9 million .
negative,Net sales have been eaten by the weak US dollar .
negative,"Nordic banks have already had to write off sizable loans in Latvia , with Swedbank , Nordea , DnB NOR and SEB reporting combined losses in excess of $ 1.35 billion in the period 2007 to 2010 against a backdrop of near economic meltdown in Latvia ."
neutral,Nordic Walking was first used as a summer training method by cross-country skiers .
negative,Okmetic expects its net sales for the first half of 2009 to be less than in 2008 .
negative,"On top of that , the US Commerce Department published worse-than-expected construction spending figures for November ."
neutral,Operating loss landed at EUR39m including one-offs and at EUR27m excluding one-offs .
negative,"Operating profit , excluding non-recurring items , totaled EUR 0.2 mn , down from EUR 0.8 mn in the corresponding period in 2006 ."
negative,"Operating profit , excluding non-recurring items , totalled EUR 1.0 mn , down from EUR 1.6 mn ."
negative,"Operating profit , excluding non-recurring items , totalled EUR 2.2 mn , down from EUR 2.7 mn in the corresponding period in 2008 ."
negative,"Operating profit excluding non-recurring items amounted to EUR 40.6 mn , down from EUR 57.3 mn year-on-year ."
negative,Operating profit excluding non-recurring items was EUR 7.8 million compared to EUR 11.2 million .
negative,Relations with the City have been further damaged by comments from Mr Ashley criticising City investors and analysts as `` cry babies '' .
negative,Reported operating margin was a negative 5.9 % .
negative,Stora Chief Executive Jouko Karvinen has described the Russian tariff hikes as a threat to the future of the forest products industry in Finland .
negative,Swedbank 's shares have been hardest hit of the Swedish banks by the ongoing international financial crisis .
negative,The acquisition of +_landsbanken Sverige in 2009 burdened the performance with EUR 3.0 mn .
negative,"The currency effect had a 3.0 pct , or 20 mln euro ( $ 31.3 mln ) , negative impact on the revenue ."
negative,The Finnish company previously said its operating result will be lower than the break-even posted a year earlier .
negative,The maritime administration said the ships had ignored warnings about the icy conditions .
negative,"The offer , deemed too low by Finnlines ' board , stands until 4 pm tomorrow ."
negative,"The period 's sales dropped to EUR 30.6 million from EUR 38.3 million , according to the interim report , released today ."
negative,The recent troubles simply make NETeller cheaper .
negative,The union filed a grievance over the company 's overtime assignment policies .
negative,"Therefore , the company 's 2005 result will remain weaker than that of 2004 ."
negative,Vaisala 's net profit for the third quarter of 2007 dropped to 3.0 mln euro ( $ 4.3 mln ) from 6.8 mln euro ( $ 9.8 mln ) for the same period of 2006 .
negative,"`` The considerably weaker U.S. dollar and British pound had an impact on sales and average prices in euros , '' UPM said ."
negative,"`` The implementation of these programs has had , and will have , negative impacts on 2006 and 2007 earnings , '' Mr Meiklejohn said ."
negative,"`` We can say that the number of deals has become normalized by the moment , and therefore we have decided to devalue our apartments now on sale , '' he added ."
negative,"`` We cut our frequency to New York last year , which explains the fall , '' he said ."
negative,"`` We see that the market continues to be tight in magazine papers , and our target is to close the deals by the end of the year . ''"
negative,A survey conducted by Taloustutkimus for Sampo Life shows that companies are badly prepared to losing key staff members .
negative,"Agricultural newspaper Maaseudun Tulevaisuus had 318,000 readers , representing a decrease of 6 % ."
negative,"At 1411 CET , ArcelorMittal had lost 7.26 % to EUR 17.38 on Euronext Paris , coming at the lead of the blue-chip fallers ."
negative,Cash flow from operations in January-December 2008 was a negative EUR 18.1 mn compared to EUR 39.0 mn in the corresponding period in 2007 .
negative,EPS dropped to EUR0 .2 from EUR0 .3 .
negative,"Kiosk and cinema operations have suffered , in particular ."
negative,Kone shares dropped 4.1 percent to  x20ac 43 US$ 55.77 in Helsinki .
negative,Ramirent made 18 million kroons EUR 1.15 mln loss last year ; the year before the company was 7.3 million kroons in the black .
negative,Return on capital employed ROCE was a negative 2.3 % compared to 11.3 % in 2007 .
negative,Stora Enso 's target has been cut to EUR 4.85 from EUR 5.55 and Holmen 's target -- to SEK 135 from SEK 150 .
negative,The dismissed staff members will now take the matter to court unless it can be settled outside .
negative,"The EU Commission said earlier it had fined ThyssenKrupp , United Technologies Corp 's Otis , Schindler AG and Kone Oyj a total of 992.3 mln eur for alleged cartel activity in the lift market going back twelve years ."
negative,"The one dark spot on the horizon , however , was the company 's performance in the Finnish bottled water market ."
negative,"The period 's sales dropped to EUR30 .6 m from EUR38 .3 m , according to the interim report , released today ."
negative,"YIT lodged counter claims against Neste Oil totaling some EUR25m , primarily based on work carried out under the contract and additional costs incurred due to prolongation of the project ."
positive,"` The stable outlook reflects Nokia 's strong market position in the global mobile handset market , strong cash flow generation , and very conservative balance sheet , ' said Raab ."
positive,"These financing arrangements will enable the company to ensure , in line with its treasury policy , that it has sufficient financial instruments at its disposal for its potential capital requirements ."
positive,"According to Karhinen , OP-Pohjola is an exciting enterprise because the cooperation will bring huge opportunities for customers and the company itself ."
positive,"Based upon its unique fiber expertise and innovative approach , the company has a strong market position in several business areas in which it operates ."
positive,"efficiency improvement measures 20 January 2010 - Finnish stationery and gift retailer Tiimari HEL : TII1V said today that it will continue to improve its operational efficiency , by focusing on its profitable core operations ."
positive,Efore 's results for the last quarter showed an even faster improvement as the company managed to better source its components .
positive,Technical indicators for the stock are bullish and S&P gives NOK a positive 4 STARS out of 5 buy ranking .
positive,"The broker highlights Cargotec as its preferred stock in the sector , as it is a pure play on global cargo and container handling , and it expects it to play an active role in further consolidating the industry ."
positive,"The restructuring creates a more efficient organization with increased operational focus and stable profitability , and leads to more efficient production , said Bo Annvik , head of Specialty Stainless ."
positive,"`` We 're delighted with the move '' says Morna Cowie , co-owner , above , `` it 's double the size of our current shop and has a lovely feel to it . ''"
positive,Elcoteq has a proven track record in electronics manufacturing services ( EMS ) and a global factory network coupled with modern manufacturing equipment and consistent systems and processes .
neutral,"Previously , the company also delivered about 70 % of the steel used in Oasis of the Seas , Allure of the Seas ' sister ship completed last year ."
positive,The main strength of the cooperation project lies in merging the know-how of two large companies .
positive,"The Dutch broker noted that Nokian Tyres reported a good first quarter in 2006 , above or in line with consensus ."
positive,"The Nokian tyre proves its high safety excellently in the important driving qualities stability with mark 1.4 , handling 1.5 and braking on wet road with 1.9 ."
positive,"The respondents praised Finnair 's reliability , Finnishness , and understanding of its target group ."
neutral,This ideally placed them in a position to tap into the potential of clean technology .
positive,"The long-standing partnership and commitment enable both parties to develop their respective operations , and ESL Shipping will also have the opportunity to update its fleet and improve its efficiency ."
positive,"Thanks to his wide contact network and good knowledge of market and business environment , he will give a great contribution to the further development of our Indian operations '' , tells Incap 's President & CEO Juhani Hanninen ."
neutral,A comprehensive range of cut-to-length and slitting services will allow Ruukki in particular to serve light engineering customers who relocate their production to the St. Petersburg area .
neutral,"Creating interfaces that are more similar to interactions in the real world can enable experiences that are more natural and intuitive , in the same way that modern games and movies are more immersive through the use of realistic 3-D graphics ."
neutral,Fiskars will be undertaking community projects throughout the UK and they are also on the lookout for local volunteers who are interested in helping out with the selected restoration projects .
neutral,"INTERNET BUSINESS NEWS - -_ 1995-2006 M2 COMMUNICATIONS LTD As part of a drive to protect users of its Internet banking service , Barclays Bank has announced that it is to recommend F-Secure Internet Security to its customers ."
positive,"Tieto was looking for an energy solution which would best support the idea of sustainable development , and we were happy to be able to provide such a solution , saysJouni Haikarainen , Vice President , Fortum ."
neutral,"According to Rautaruukki , the company wants to promote the use of emission-free energy sources ."
neutral,Atria chose the DeLight to attract consumers in the 25-45 age group to its Atria Fresh range of microwaveable meals .
positive,"I use natural fibers to make the clothes more comfortable , to allow your skin to breathe and to be eco-friendly ."
neutral,"In addition , a good biological durability is achieved . ''"
neutral,"The newly-completed Allure of the Seas and its identical sister ship , Oasis of the Seas , which was completed last year are the world 's largest cruise ships ."
